product_name,product_url,avg_rating,number_sold,number_reviews,product_imgs,current_price,discount_rate,original_price,brand_name,brand_url,seller_name,seller_url,review,feature,category,detail,description
Sữa Bột Frisolac Gold 1 850g Dành Cho Trẻ Từ 0 - 6 Tháng Tuổi,https://tiki.vn/sua-bot-frisolac-gold-1-850g-danh-cho-tre-tu-0-6-thang-tuoi-p88924594.html?spid=88924595,,Đã bán 31k,(330),"https://salt.tikicdn.com/cache/200x280/ts/product/21/30/71/d165e9054bb0d693b915c20a75504239.jpg,https://salt.tikicdn.com/cache/200x280/media/catalog/producttmp/ee/f6/67/f5dca0b34d64a2668a34bf08e722dc35.png,https://salt.tikicdn.com/cache/200x280/media/catalog/producttmp/80/de/6c/2329dc2e4f3c3a46d8da3a70e03a6ce5.png,https://salt.tikicdn.com/cache/200x280/ts/product/e8/a6/cf/3cdea933a1041aa5caad2f62c987f1b1.png,https://salt.tikicdn.com/cache/200x280/ts/product/95/19/8b/ff2978097918708885b7e7e1468ed039.jpg,https://salt.tikicdn.com/cache/200x280/ts/product/85/29/65/3aa9150d7507a110588e868aa42a9c8f.jpg",490.000₫,,,Friso,https://tiki.vn/thuong-hieu/friso.html,Tiki Trading,https://tiki.vn/cua-hang/tiki-trading?source_screen=product_detail&source_engine=organic,,"Dưỡng chất từ thiên nhiên: NOVAS Signature Milk - nguồn sữa chất lượng tại trang trại Hà Lan.,Quy trình LockNutri giúp bảo vệ đạm sữa trong suốt quá trình sản xuất không bị biến chất bởi nhiệt độ cao - giúp bé dễ tiêu hóa.,Dưỡng chất quan trọng hỗ trợ miễn dịch, tăng trưởng và sự phát triển toàn diện của trẻ: Vitamin D - Selen - Prebiotic(GOS).",Trang chủ;;Đồ Chơi - Mẹ & Bé;;Dinh dưỡng cho bé;;Sữa bột cho bé;;Sữa cho bé dưới 24 tháng;;Sữa Bột Frisolac Gold 1 850g Dành Cho Trẻ Từ 0 - 6 Tháng Tuổi,,
Combo 3 lon Sữa Morinaga số 2 Chilmil 850g và 1 lon sữa Morinaga số 2 320gr dành cho bé từ 6-36 tháng tuổi,https://tiki.vn/combo-3-lon-sua-morinaga-so-2-chilmil-850g-va-1-lon-sua-morinaga-so-2-320gr-danh-cho-be-tu-6-36-thang-tuoi-p82525136.html?spid=82525137,4.9,Đã bán 1k,(111),"https://salt.tikicdn.com/cache/200x280/ts/product/62/a4/be/5f313113d7a610fb62ca732098a8e275.jpg,https://salt.tikicdn.com/cache/200x280/ts/product/98/6d/5a/206f15585fca607f5118fd71a3f92e32.jpg,https://salt.tikicdn.com/cache/200x280/ts/product/9d/c1/e1/26eb525825947dfeee5268f7f8fbac2a.jpg,https://salt.tikicdn.com/cache/200x280/ts/product/99/13/38/5353a9f0f2b3310dedc115f1662aa835.jpg,https://salt.tikicdn.com/cache/200x280/ts/product/0a/80/4f/3d369c19d4175a6390af27bec34e197d.jpg,https://salt.tikicdn.com/cache/200x280/ts/product/1a/30/6f/5fbdfe632c223ac42197c8d223b9cae2.jpg,https://salt.tikicdn.com/cache/200x280/ts/product/0a/6d/c2/e2cb4128233de5390b871fc62818e9bf.jpg,https://salt.tikicdn.com/cache/200x280/ts/product/e3/01/97/969bc103fcd382fc5f0a2b28173914a1.jpg",1.449.000₫,-16%,1.734.000₫,Morinaga,https://tiki.vn/thuong-hieu/morinaga.html,Tiki Trading,https://tiki.vn/cua-hang/tiki-trading?source_screen=product_detail&source_engine=organic,"[['<span><img alt=""star-icon"" src=""https://salt.tikicdn.com/ts/upload/e3/f0/86/efd76e1d41c00ad8ebb7287c66b559fd.png"" width=""20"" height=""20""></span><span><img alt=""star-icon"" src=""https://salt.tikicdn.com/ts/upload/e3/f0/86/efd76e1d41c00ad8ebb7287c66b559fd.png"" width=""20"" height=""20""></span><span><img alt=""star-icon"" src=""https://salt.tikicdn.com/ts/upload/e3/f0/86/efd76e1d41c00ad8ebb7287c66b559fd.png"" width=""20"" height=""20""></span><span><img alt=""star-icon"" src=""https://salt.tikicdn.com/ts/upload/e3/f0/86/efd76e1d41c00ad8ebb7287c66b559fd.png"" width=""20"" height=""20""></span><span><img alt=""star-icon"" src=""https://salt.tikicdn.com/ts/upload/e3/f0/86/efd76e1d41c00ad8ebb7287c66b559fd.png"" width=""20"" height=""20""></span><div style=""width: 100%;""><span><img alt=""star-icon"" src=""https://salt.tikicdn.com/ts/upload/e3/f0/86/efd76e1d41c00ad8ebb7287c66b559fd.png"" width=""20"" height=""20""></span><span><img alt=""star-icon"" src=""https://salt.tikicdn.com/ts/upload/e3/f0/86/efd76e1d41c00ad8ebb7287c66b559fd.png"" width=""20"" height=""20""></span><span><img alt=""star-icon"" src=""https://salt.tikicdn.com/ts/upload/e3/f0/86/efd76e1d41c00ad8ebb7287c66b559fd.png"" width=""20"" height=""20""></span><span><img alt=""star-icon"" src=""https://salt.tikicdn.com/ts/upload/e3/f0/86/efd76e1d41c00ad8ebb7287c66b559fd.png"" width=""20"" height=""20""></span><span><img alt=""star-icon"" src=""https://salt.tikicdn.com/ts/upload/e3/f0/86/efd76e1d41c00ad8ebb7287c66b559fd.png"" width=""20"" height=""20""></span></div>', 'Đúng với hình miêu tả , hạn sử dụng sản phẩm ok , đóng gói cẩn thận ko bị móp méo . Tiki NOW giao hàng siêu tốc ,đặt là có liền không phải đợi chờ .', ['background-image: url(""https://salt.tikicdn.com/cache/w280/ts/review/fd/44/6d/87004a531f2e7950275723115b8f3d1d.jpg"");', 'background-image: url(""https://salt.tikicdn.com/cache/w280/ts/review/df/0a/3f/f65b078ff7e79bc8fec44bb5851781b0.jpg"");', 'background-image: url(""https://salt.tikicdn.com/cache/w280/ts/review/e6/00/29/680ce4e5872c05c56487b6359257dc07.jpg"");', 'background-image: url(""https://salt.tikicdn.com/cache/w280/ts/review/e9/36/f0/5b263b8f64750a27bc58819a4a3ac553.jpg"");', 'background-image: url(""https://salt.tikicdn.com/cache/w280/ts/review/ec/fa/25/d4b26443003be07f92c6cef48d17237b.jpg"");']], ['<span><img alt=""star-icon"" src=""https://salt.tikicdn.com/ts/upload/e3/f0/86/efd76e1d41c00ad8ebb7287c66b559fd.png"" width=""20"" height=""20""></span><span><img alt=""star-icon"" src=""https://salt.tikicdn.com/ts/upload/e3/f0/86/efd76e1d41c00ad8ebb7287c66b559fd.png"" width=""20"" height=""20""></span><span><img alt=""star-icon"" src=""https://salt.tikicdn.com/ts/upload/e3/f0/86/efd76e1d41c00ad8ebb7287c66b559fd.png"" width=""20"" height=""20""></span><span><img alt=""star-icon"" src=""https://salt.tikicdn.com/ts/upload/e3/f0/86/efd76e1d41c00ad8ebb7287c66b559fd.png"" width=""20"" height=""20""></span><span><img alt=""star-icon"" src=""https://salt.tikicdn.com/ts/upload/e3/f0/86/efd76e1d41c00ad8ebb7287c66b559fd.png"" width=""20"" height=""20""></span><div style=""width: 100%;""><span><img alt=""star-icon"" src=""https://salt.tikicdn.com/ts/upload/e3/f0/86/efd76e1d41c00ad8ebb7287c66b559fd.png"" width=""20"" height=""20""></span><span><img alt=""star-icon"" src=""https://salt.tikicdn.com/ts/upload/e3/f0/86/efd76e1d41c00ad8ebb7287c66b559fd.png"" width=""20"" height=""20""></span><span><img alt=""star-icon"" src=""https://salt.tikicdn.com/ts/upload/e3/f0/86/efd76e1d41c00ad8ebb7287c66b559fd.png"" width=""20"" height=""20""></span><span><img alt=""star-icon"" src=""https://salt.tikicdn.com/ts/upload/e3/f0/86/efd76e1d41c00ad8ebb7287c66b559fd.png"" width=""20"" height=""20""></span><span><img alt=""star-icon"" src=""https://salt.tikicdn.com/ts/upload/e3/f0/86/efd76e1d41c00ad8ebb7287c66b559fd.png"" width=""20"" height=""20""></span></div>', 'TiKi Now giao rất nhanh. Sữa 3 hộp lớn date xa, tặng hộp nhỏ date xa hơn. Đóng gói cẩn thận. Sẽ ủng hộ Shop tiếp tục nếu Bé Trai nhà mình uống chịu và okay.', ['background-image: url(""https://salt.tikicdn.com/cache/w280/ts/review/03/9c/ab/7e401305125bda4a97308789c1ad2536.jpg"");', 'background-image: url(""https://salt.tikicdn.com/cache/w280/ts/review/a4/f3/c3/06106c190ca5ff7e90b1c903e3b4ead7.jpg"");', 'background-image: url(""https://salt.tikicdn.com/cache/w280/ts/review/77/9d/0f/30dbbed38edbc2054fb184d03a0e2ac5.jpg"");', 'background-image: url(""https://salt.tikicdn.com/cache/w280/ts/review/fe/06/4a/6332997d8f976e9b67c24a3cfe6626bf.jpg"");']], ['<span><img alt=""star-icon"" src=""https://salt.tikicdn.com/ts/upload/e3/f0/86/efd76e1d41c00ad8ebb7287c66b559fd.png"" width=""20"" height=""20""></span><span><img alt=""star-icon"" src=""https://salt.tikicdn.com/ts/upload/e3/f0/86/efd76e1d41c00ad8ebb7287c66b559fd.png"" width=""20"" height=""20""></span><span><img alt=""star-icon"" src=""https://salt.tikicdn.com/ts/upload/e3/f0/86/efd76e1d41c00ad8ebb7287c66b559fd.png"" width=""20"" height=""20""></span><span><img alt=""star-icon"" src=""https://salt.tikicdn.com/ts/upload/e3/f0/86/efd76e1d41c00ad8ebb7287c66b559fd.png"" width=""20"" height=""20""></span><span><img alt=""star-icon"" src=""https://salt.tikicdn.com/ts/upload/e3/f0/86/efd76e1d41c00ad8ebb7287c66b559fd.png"" width=""20"" height=""20""></span><div style=""width: 100%;""><span><img alt=""star-icon"" src=""https://salt.tikicdn.com/ts/upload/e3/f0/86/efd76e1d41c00ad8ebb7287c66b559fd.png"" width=""20"" height=""20""></span><span><img alt=""star-icon"" src=""https://salt.tikicdn.com/ts/upload/e3/f0/86/efd76e1d41c00ad8ebb7287c66b559fd.png"" width=""20"" height=""20""></span><span><img alt=""star-icon"" src=""https://salt.tikicdn.com/ts/upload/e3/f0/86/efd76e1d41c00ad8ebb7287c66b559fd.png"" width=""20"" height=""20""></span><span><img alt=""star-icon"" src=""https://salt.tikicdn.com/ts/upload/e3/f0/86/efd76e1d41c00ad8ebb7287c66b559fd.png"" width=""20"" height=""20""></span><span><img alt=""star-icon"" src=""https://salt.tikicdn.com/ts/upload/e3/f0/86/efd76e1d41c00ad8ebb7287c66b559fd.png"" width=""20"" height=""20""></span></div>', 'Tiki giao hàng nhanh, gói bọc cẩn thận ko bị móm méo, date 3 hộp to 11/7/2023, hộp nhỏ là 3/2023, hàng đầy đủ tem mác. Bỉm unidry sờ hơi cứng, thô, dày, có mùi', ['background-image: url(""https://salt.tikicdn.com/cache/w280/ts/review/ed/3d/0c/2143b5a645c79a1933deb2a2b903897b.jpg"");', 'background-image: url(""https://salt.tikicdn.com/cache/w280/ts/review/55/14/e5/f7fb50e0d1713102baec5df14715c619.jpg"");', 'background-image: url(""https://salt.tikicdn.com/cache/w280/ts/review/b5/85/c5/b7f18880d39f56a6088665eebbcb4fbb.jpg"");', 'background-image: url(""https://salt.tikicdn.com/cache/w280/ts/review/d6/4c/75/23a4a34cf677f6e769c0dcecd53bcd8f.jpg"");']], ['<span><img alt=""star-icon"" src=""https://salt.tikicdn.com/ts/upload/e3/f0/86/efd76e1d41c00ad8ebb7287c66b559fd.png"" width=""20"" height=""20""></span><span><img alt=""star-icon"" src=""https://salt.tikicdn.com/ts/upload/e3/f0/86/efd76e1d41c00ad8ebb7287c66b559fd.png"" width=""20"" height=""20""></span><span><img alt=""star-icon"" src=""https://salt.tikicdn.com/ts/upload/e3/f0/86/efd76e1d41c00ad8ebb7287c66b559fd.png"" width=""20"" height=""20""></span><span><img alt=""star-icon"" src=""https://salt.tikicdn.com/ts/upload/e3/f0/86/efd76e1d41c00ad8ebb7287c66b559fd.png"" width=""20"" height=""20""></span><span><img alt=""star-icon"" src=""https://salt.tikicdn.com/ts/upload/e3/f0/86/efd76e1d41c00ad8ebb7287c66b559fd.png"" width=""20"" height=""20""></span><div style=""width: 100%;""><span><img alt=""star-icon"" src=""https://salt.tikicdn.com/ts/upload/e3/f0/86/efd76e1d41c00ad8ebb7287c66b559fd.png"" width=""20"" height=""20""></span><span><img alt=""star-icon"" src=""https://salt.tikicdn.com/ts/upload/e3/f0/86/efd76e1d41c00ad8ebb7287c66b559fd.png"" width=""20"" height=""20""></span><span><img alt=""star-icon"" src=""https://salt.tikicdn.com/ts/upload/e3/f0/86/efd76e1d41c00ad8ebb7287c66b559fd.png"" width=""20"" height=""20""></span><span><img alt=""star-icon"" src=""https://salt.tikicdn.com/ts/upload/e3/f0/86/efd76e1d41c00ad8ebb7287c66b559fd.png"" width=""20"" height=""20""></span><span><img alt=""star-icon"" src=""https://salt.tikicdn.com/ts/upload/e3/f0/86/efd76e1d41c00ad8ebb7287c66b559fd.png"" width=""20"" height=""20""></span></div>', 'Nutren Junior 50% Đạm Whey là sản phẩm dinh dưỡng chuyên biệt cho trẻ nhẹ cân thấp còi từ 1-10 tuổi, được nhập khẩu trực tiếp từ Thụy Sĩ. Với công thức TĂNG TRƯỞNG 3 CHUẨN độc quyền từ Nestlé Thụy Sĩ, bổ sung 50% đạm Whey có tỉ lệ hấp thu lên đến 92%, hỗ trợ tiêu hóa và tăng cường hấp thu giúp trẻ hồi phục và bắt kịp đà tăng trưởng, phát triển Thu gọn', []], ['<span><img alt=""star-icon"" src=""https://salt.tikicdn.com/ts/upload/e3/f0/86/efd76e1d41c00ad8ebb7287c66b559fd.png"" width=""20"" height=""20""></span><span><img alt=""star-icon"" src=""https://salt.tikicdn.com/ts/upload/e3/f0/86/efd76e1d41c00ad8ebb7287c66b559fd.png"" width=""20"" height=""20""></span><span><img alt=""star-icon"" src=""https://salt.tikicdn.com/ts/upload/e3/f0/86/efd76e1d41c00ad8ebb7287c66b559fd.png"" width=""20"" height=""20""></span><span><img alt=""star-icon"" src=""https://salt.tikicdn.com/ts/upload/e3/f0/86/efd76e1d41c00ad8ebb7287c66b559fd.png"" width=""20"" height=""20""></span><span><img alt=""star-icon"" src=""https://salt.tikicdn.com/ts/upload/e3/f0/86/efd76e1d41c00ad8ebb7287c66b559fd.png"" width=""20"" height=""20""></span><div style=""width: 100%;""><span><img alt=""star-icon"" src=""https://salt.tikicdn.com/ts/upload/e3/f0/86/efd76e1d41c00ad8ebb7287c66b559fd.png"" width=""20"" height=""20""></span><span><img alt=""star-icon"" src=""https://salt.tikicdn.com/ts/upload/e3/f0/86/efd76e1d41c00ad8ebb7287c66b559fd.png"" width=""20"" height=""20""></span><span><img alt=""star-icon"" src=""https://salt.tikicdn.com/ts/upload/e3/f0/86/efd76e1d41c00ad8ebb7287c66b559fd.png"" width=""20"" height=""20""></span><span><img alt=""star-icon"" src=""https://salt.tikicdn.com/ts/upload/e3/f0/86/efd76e1d41c00ad8ebb7287c66b559fd.png"" width=""20"" height=""20""></span><span><img alt=""star-icon"" src=""https://salt.tikicdn.com/ts/upload/e3/f0/86/efd76e1d41c00ad8ebb7287c66b559fd.png"" width=""20"" height=""20""></span></div>', 'Tuyệt ạ hình ảnh chỉ mang tính chất minh hoạ ạ', ['background-image: url(""https://salt.tikicdn.com/cache/w280/ts/review/4f/29/3a/60db91e00fdba688ce15cf6be3c5ea25.jpg"");', 'background-image: url(""https://salt.tikicdn.com/cache/w280/ts/review/22/1e/80/3a0b2b790ad42711d215c73e0921d89d.jpg"");']]]","Sữa Morinaga bổ sung Lactoferrin, tăng cường miễn dịch cho bé.,Tiền lợi khuẩn Bifidus hỗ trợ tiêu hóa và ngăn ngừa táo bón.,DHA/ARA giúp phát triển trí não và thị giác của bé.",Trang chủ;;Đồ Chơi - Mẹ & Bé;;Dinh dưỡng cho bé;;Sữa bột cho bé;;Sữa cho bé trên 24 tháng;;Combo 3 lon Sữa Morinaga số 2 Chilmil 850g và 1 lon sữa Morinaga số 2 320gr dành cho bé từ 6-36 tháng tuổi,"Thành phần
Tham khảo mô tả,Khối lượng (kg)
0.32,Thương hiệu
Morinaga,Xuất xứ thương hiệu
Nhật Bản,Xuất xứ (Made in)
Nhật Bản,Hạn sử dụng
2 năm kể từ ngày sản xuất,Sản phẩm có được bảo hành không?
Không","Giới thiệu
Combo 3 Lon Sữa Morinaga Số 2 Chilmil 850gr + 1 Lon Sữa Morinaga Số 2 320g được nhập khẩu nguyên lon từ Nhật Bản, dành cho trẻ từ 6-36 tháng tuổi, cung cấp các chất dinh dưỡng cần thiết với tỷ lệ cân bằng gần giống sữa mẹ, hỗ trợ chăm sóc trẻ phát triển toàn diện. Sử dụng để bổ sung dinh dưỡng cho trẻ từ giai đoạn ăn dặm.
Morinaga là hãng sữa đầu tiên trên thế giới bổ sung Lactoferrin, dưỡng chất đóng vai trò kháng thể có nhiều trong sữa mẹ, đặc biệt là sữa non giúp kháng khuẩn, kháng virus, tăng cường khả năng miễn dịch cho trẻ lên gấp 2 lần. Nhờ đó, bé phát triển khoẻ mạnh, có sức đề kháng tốt.
Đặc điểm nổi bật
Bổ sung tiền lợi khuẩn Bifidus(Lactose và Raffinose) giúp tăng cường lợi khuẩn, hỗ trợ tiêu hóa và ngăn ngừa táo bón.
Tăng cường DHA/ARA đem lại nhiều lợi ích quan trọng cho trẻ trong 6 tháng đầu đời:
Phát triển trí não và hệ thần kinh trung ương.
Phát triển về chức năng thị giác và chức năng võng mạc.
Phát triển nhận thức và hành vi.
Tăng cường miễn dịch với các bệnh dị ứng và viêm da dị ứng.
Bổ sung và cân bằng nhiều vitamin và khoáng chất cần thiết (Canxi, Sắt, Kẽm, I ốt,…) giúp bé phát triển cao lớn, thông minh, khoẻ mạnh.
Sản phẩm dinh dưỡng Morinaga được sản xuất theo dây chuyền tự động đạt chuẩn ISO 22000, dựa trên nghiên cứu mới nhất về nhu cầu dinh dưỡng cho trẻ theo Tiêu chuẩn quốc tế Codex và Bộ Y tế Việt Nam.
Sữa dễ tan, vị nhạt thanh, dễ uống.
Đối tượng sử dụng
Dành cho bé từ 6 tháng - 3 tuổi
Thành phần
Lactose, Dầu thực vật (dầu cọ, dầu hạt cọ, dầu nành, dầu hạt cải), Dextrin, Bột Whey khử khoáng, Casein, Sữa tách kem, Đạm Whey cô đặc, Bột Whey, Bột bơ sữa, Calci carbonat, Magnesi Chlorid, Tricalcium diphosphate (Calcium phosphate, tribasic), Raffinose, chất nhũ hóa (E340(iii)), Calci Clorid, Dầu cá, Lactulose syrup, Chất nhũ hóa Lecithin (E322(i)), Natri citrat, Kali carbonat, Chất điều chỉnh độ acid: Acid citric (E330), Vitamin C (Natri L-ascorbat), Dipotassium hydrogen phosphate, Lactoferrin, Hydrolyzed casein, Arachidonic acid, Sắt (III) Pyrophosphat, Kẽm Sulfat, Cytidine 5'- monophosphate, Disodium inosine 5'- monophosphate, Nicotinamide, Vitamin E (DL-alpha-tocopherol), Vitamin D (Cholecalciferol), Disodium guanosine 5'-monophosphate, Calci D-pantothenat, Disodium uridine 5'-monophosphate, Adenosine 5'-monophosphate, Vitamin A (Retinyl palmitat), Vitamin B1 (Thiamin hydroclorid), Vitamin B6 (Pyridoxin hydroclorid), Vitamin B2 (Natri - riboflavin 5'-phosphat), Acid Folic (acid pteroymonoglutamic), Beta-Carotene, Kali Iodat, Vitamin K1 (Phytomenadion), D- Biotin, Vitamin B12 (Cyanocobalamin).
Hướng dẫn sử dụng
Rửa tay và các dụng cụ pha bằng nước và xà phòng thật kỹ. Đun sôi nước và để nguội xuống còn khoảng 50 độ C. Rót 100ml đun sôi để nguội ở trên vào bình hoặc cốc. Cho 5 muỗng Chilmil (muỗng đi kèm trong hộp) vào bình, lắc đều cho đến khi tan hết. Thêm nước ấm cho đủ 200ml rồi lắc nhẹ cho hòa tan hết. Chỉ cho bé uống khi đã làm nguội đến bằng nhiệt độ cơ thể.
HƯỚNG DẪN PHA 1 BÌNH 160ML
***Lưu ý: Vệ sinh sạch dụng cụ pha và sử dụng nước đun sôi để nguội 50℃. 1 muỗng gạt ngang pha được 40ml thành phẩm ( gồm sữa + nước).
Bước 1: Cho khoảng 2/3 lượng nước 50℃ vào bình sữa
Bước 2: Cho 4 muỗng sữa gạt ngang vào bình, dùng muỗng khuấy nhẹ theo 1 chiều hoặc đậy nắp chặt vừa phải lắc tròn xoay nhẹ cổ tay cho đến khi sữa tan
Bước 3: Châm thêm nước 50 độ vào bình cho đủ 160ml. Nếu sữa còn nóng mẹ ngâm trong ca nước cho nguội xuống bằng nhiệt độ cơ thể rồi cho bé dùng nhé.
Hướng dẫn bảo quản
Để các dụng cụ pha, kể cả muỗng lường ở nơi khô ráo và sạch sẽ. Sau mỗi lần sử dụng, đậy thật chặt nắp hộp và bảo quản nơi khô ráo, thoát mát để sản phẩm không bị bụi và nhiễm khuẩn. Không bảo quản trong tủ lạnh. Sau khi mở hộp, nên sử dụng hết trong vòng 1 tháng
Giá sản phẩm trên Tiki đã bao gồm thuế theo luật hiện hành. Bên cạnh đó, tuỳ vào loại sản phẩm, hình thức và địa chỉ giao hàng mà có thể phát sinh thêm chi phí khác như phí vận chuyển, phụ phí hàng cồng kềnh, thuế nhập khẩu (đối với đơn hàng giao từ nước ngoài có giá trị trên 1 triệu đồng)....."
